{
  "id": "minimal_example",
  "algorithmName": "Quantum Fourier Transform",
  "device": "Simulator",
  "metricName": "Fidelity",
  "metricValue": 0.99,
  "timestamp": "2024-11-21T09:00:00Z",
  "description": "QFT implementation without error rate data",
  "notes": "This example shows that error rate fields are optional"
}