{
  "id": "shors_15",
  "algorithmName": "Shor's Algorithm",
  "team": ["P. Shor"],
  "device": "IonQ Harmony",
  "metricName": "Success Probability",
  "metricValue": 0.99,
  "uncertainty": 0.01,
  "paperUrl": "https://arxiv.org/abs/quant-ph/9508027",
  "timestamp": "2024-05-10T10:00:00Z",
  "qasmFiles": ["shor_15_factoring.qasm"],
  "description": "Implementation of Shor's algorithm for factoring 15",
  "methodology": "Quantum Fourier Transform based period finding",
  "notes": "Used optimized quantum circuits with error mitigation"
}